video_id,title,publishedAt,channelId,channelTitle,category,trending_date,tags,view_count,likes,dislikes,comment_count,thumbnail_link,comments_disabled,ratings_disabled,description
"t4VKfH9X4Mw","【ご報告】永ennのアリス、無事に出産を終えました！！！","2024-10-14T10:00:54Z","UCjNrxV6lbQZHK8E5LfNHmUg","フォーエイト48","Entertainment","24.18.10","[none]","541076","12545","0","794","https://i.ytimg.com/vi/t4VKfH9X4Mw/default.jpg","False","False","編集：enn個人チャンネルでも出産時の様子をお届けしております。https://youtu.be/ZGebPts05jg?si=PsTDvKqcIjHAwgrI@ennnn_em この度帝王切開にて女の子を出産致しました。壮絶な3日間で出産とは本当に命がけなことだと実感しました。これから育児に専念するため中々フォーエイトの撮影も参加できませんが余裕ができたらまたフォーエイトでお愛しましょう。そして久々にフォーエイトのカット割りさせていただいたんですが昔を思い出して楽しかったですっ👍👍これからもフォーエイトの動画沢山見てねっ！【毎日投稿実施中！！】チャンネル登録はこちら/Please Subscribe！！⬇︎⬇︎⬇︎http://www.youtube.com/channel/UCjNrxV6lbQZHK8E5LfNHmUg?sub_confirmation=1サブチャンネルのチャンネル登録はこちら/Please Subscribe！！⬇︎⬇︎⬇︎http://www.youtube.com/channel/UCdu1RE2lfnx97ARGjsHjEBw?sub_confirmation=1【メンバーシップのご登録】https://www.youtube.com/channel/UCjNrxV6lbQZHK8E5LfNHmUg/join-SNS-【こたつ】■ Twitter ⇒ https://twitter.com/kotachumu■ Instagram ⇒ http://Instagram.com/kotachumu ■ TikTok ⇒ https://www.tiktok.com/@kotachumu■ YouTube ⇒ https://www.youtube.com/@KotaSena2023■LINE VOOM ⇒ https://linevoom.line.me/user/_ddc0HC_GK_GZRmt3w10f_ZfuYIPDry_NYgfNC1Y【あみか】■ Twitter ⇒ https://twitter.com/amika429 ■ Instagram ⇒ http://Instagram.com/amika_tanaka0429■ TikTok ⇒ https://www.tiktok.com/@amika0429.14■ YouTube ⇒ https://youtube.com/channel/UC9Gno1_VQX29lmpM5cy6KYw?sub_confirmation=1■LINE VOOM ⇒ https://linevoom.line.me/user/_dV4UL1HqwA7_BbSlZ6W3R-U8BnKOaim59LC4iQM【タロー社長】■ Twitter ⇒ https://twitter.com/torasann1998 ■ Instagram ⇒ https://www.instagram.com/taroshacho■ TikTok ⇒ https://www.tiktok.com/@taro0429■ YouTube⇒ https://www.youtube.com/channel/UCPn_e-7LD7SbzIBxdU_XBnQ■LINE VOOM ⇒ https://linevoom.line.me/user/_deQ6vp9UH-LOyqAScD_VkJY7g7PewPrH9ZD5kZI【永ennのアリス】■ Twitter ⇒ https://twitter.com/ennnnn_em ■ Instagram ⇒ http://Instagram.com/ennnnn_em ■ TikTok ⇒ https://www.tiktok.com/@enn_alice0419◾️YouTube⇒https://www.youtube.com/channel/UCDuCrgH3hlJ2A0r3vD0WmRQ■LINE VOOM ⇒ https://linevoom.line.me/user/_deJgKQW_3-T7ybSCItc89mD3g5WIqDsNWgwa6Rg【ゑむ氏。】■ Twitter ⇒ https://twitter.com/0607_Emushi■ Instagram ⇒ http://Instagram.com/mk0607mg ■ TikTok ⇒ https://www.tiktok.com/@mari0607_mg■ YouTube ⇒ https://www.youtube.com/channel/UCvFiofvThMeCwlLWBdimsFQ■LINE VOOM ⇒ https://linevoom.line.me/user/_dRGR8cGvMWL2U6yaS-6ANyA3fjfBLvu4HU9lY5o【わかゔぁ】■ Twitter ⇒ https://twitter.com/VaAa_48■ Instagram ⇒ http://Instagram.com/wakavaaa3150 ■ TikTok ⇒ https://www.tiktok.com/@vaaalv.max■ YouTube⇒  https://youtube.com/channel/UCrK88m5EQOvkXKPFHpgTUmQ?sub_confirmation=1■LINE VOOM ⇒ https://linevoom.line.me/user/_dc8WiOnoeHS_AwSDwuFwKTWWmFP3-c2CYyVKNd8【アマリザ】■ Twitter ⇒ https://twitter.com/Amariza48■ Instagram ⇒ http://Instagram.com/amariza4 ■TikTok ⇒ https://www.tiktok.com/@amarizalv.max■ YouTube⇒  https://youtube.com/channel/UCrK88m5EQOvkXKPFHpgTUmQ?sub_confirmation=1■LINE VOOM ⇒ https://linevoom.line.me/user/_dc-kyTHTlq2eH7FxEh0q3ut4nocXK2TOAU1f5h0【フォーエイト】■ Twitter ⇒ https://twitter.com/WeAreTeam48■ Instagram ⇒ http://Instagram.com/weareteam48■ TikTok ⇒ https://www.tiktok.com/@weareteam48■LINE VOOM ⇒ https://linevoom.line.me/user/_de0Rzytfyh_wI5r88EA6VIr43FlcZVbb8qDcT9Aファンレター・プレゼントの宛先はこちらまで！！〒542-0086大阪市中央区西心斎橋1-10-17 ポポロビル4階S号お問い合わせのメールアドレスinfo@48studio.jp#フォーエイト #出産 #報告"
"OOyfNm5-r6U","【協力脱出ホラー】弟者,兄者,おついちの「ノロイカゴ ゲゲゲの夜 体験版」【2BRO.】","2024-10-15T12:00:41Z","UC2GuoutVyegg6PUK88lLpjw","兄者弟者","Gaming","24.18.10","[none]","253152","4753","0","64","https://i.ytimg.com/vi/OOyfNm5-r6U/default.jpg","False","False","★最新投稿情報はツイッターで！《@Otojya》https://twitter.com/otojya▼2BRO.関連チャンネルリスト【兄者弟者チャンネルTOP】https://www.youtube.com/user/norunine【兄者のゲーム事務所（兄ゲー）TOP】https://www.youtube.com/channel/UCzSi25RJfQNtQzXNYQUAcNA【おついち TubeチャンネルTOP】https://www.youtube.com/user/afuramazda08262024/10/14 体験版配信「#ノロイカゴゲゲゲの夜」#弟者#兄者 #おついち"
"_T0-8SL6iRA","やらかしました。動画が出せなくなりました。","2024-10-14T10:35:02Z","UCgMPP6RRjktV7krOfyUewqw","はじめしゃちょー（hajime）","Entertainment","24.18.10","hajime|はじめしゃちょー|funny|crazy|japanese|はじめ","1539771","37569","0","3029","https://i.ytimg.com/vi/_T0-8SL6iRA/default.jpg","False","False","チャンネル登録よろしくおねがいします !My name is Hajime! ファンサイトはこちら。▽「はじメーノ」：https://fanicon.net/fancommunities/4246はじめしゃちょーの畑：https://www.youtube.com/channel/UClKeJXipXwX7_ZGxOBnMQywはじめしゃちょー2（ゲーム実況など）：https://www.youtube.com/user/hajimexgameX(Twitter): https://twitter.com/hajimesyachoInstagram: https://instagram.com/hajimesyachodesu?r=nametagTikTok: https://vt.tiktok.com/ZSJ18mmm5/Clubhouse:@hajimen裏垢:https://twitter.com/duelhajimeLINEスタンプはこちら！はじめしゃちょーhttps://store.line.me/stickershop/product/1072663/jaはじめしゃちょー2https://store.line.me/stickershop/product/1169745/ja・動画内における素材提供 ＿人人人人＿＞　PIXTA　＜￣Y^Y^Y￣------------------------------------------------------------------------------ 楽曲提供：Production Music by http://www.epidemicsound.com                     フリーBGM DOVA-SYNDROME by http://dova-s.jp/　　　　　BGMer:https://bgmer.net/------------------------------------------------------------------------------"
"lGQDHKzLznE","W●RK / 星街すいせい×葛葉(Cover)","2024-10-12T09:00:06Z","UC5CwaMl1eIgY8h02uZw7u8A","Suisei Channel","Entertainment","24.18.10","ホロライブ|hololive|ホロライブゲーマーズ|歌ってみた|ゲーム実況|実況|バーチャルyoutuber|Vtuber|VTuber|バーチャルYouTuber|VR|3D|ときのそら|ロボ子さん|夜空メル|アキ・ローゼンタール|赤井はあと|白上フブキ|夏色まつり|湊あくあ|紫咲シオン|百鬼あやめ|癒月ちょこ|大空スバル|大神ミオ|さくらみこ|猫又おかゆ|戌神ころね|兎田ぺこら|潤羽るしあ|不知火フレア|宝鐘マリン|白銀ノエル|AZKi|星街すいせい|天音かなた|桐生ココ|姫森ルーナ|角巻わため|常闇トワ|雪花ラミィ|桃鈴ねね|獅白ぼたん|魔乃アロエ|尾丸ポルカ","2489156","0","0","4537","https://i.ytimg.com/vi/lGQDHKzLznE/default.jpg","False","True","🍎Ｗ●ＲＫ / ꉈꀧ꒒꒒ꁄꍈꍈꀧ꒦ꉈ ꉣꅔꎡꅔꁕꁄ × 椎名林檎https://youtu.be/dYzgZVhiqmU?si=P5aRQq95tP42Oa03🍎イラストtonoshi　https://x.com/nempopoひなつ　https://x.com/toubou_hpmy釧路くき　https://x.com/kuki8117🍎映像 /  みやざわえそらhttps://x.com/miyazawano🍎instizumi https://x.com/izumi_nibiir特選おはし https://x.com/tokusenohashi🍎MIX / さんかくずわりhttps://x.com/Sankaku_Mix🍎歌葛葉　@Kuzuha 星街すいせい @HoshimachiSuisei▼▼▼▼▼▼▼▼▼▼▼▼▼▼▼▼▼▼▼▼　※ホロライブプロダクションから未成年の視聴者の方々へのお願い　[カバー 未成年者の方々へ]で検索してお読みの上、お楽しみください。　https://hololivepro.com/request-to-minors/▼▼▼▼▼▼▼▼▼▼▼▼▼▼▼▼▼▼▼▼"
"gRWefI0C0ZY","【祝11周年】５ヶ月休憩！活動再開！過去一怒涛だった波乱の一年を振り返りSP！！！","2024-10-12T12:00:06Z","UCutJqz56653xV2wwSvut_hQ","東海オンエア","Comedy","24.18.10","[none]","2811435","123385","0","9403","https://i.ytimg.com/vi/gRWefI0C0ZY/default.jpg","False","False","今年もこの日がやって参りました。皆様のおかげで大事な大事な東海オンエア11周年を迎えることができました。ワンチャンもう周年を迎えられないかとすら思う瞬間もありましたがなんとか11歳。小学五年生です。ひとまずこのまま素敵な小学校卒業を目指してここからまた一年頑張っていくので応援よろしくお願いします！！！(編集：てつや)▼書籍に関してはこちらをチェック！https://uuum.jp/posts/10000どうも、東海オンエアです。ぜひチャンネル登録お願いします！サブチャンネル【東海オンエアの控え室】もぜひチャンネル登録してね！！！https://www.youtube.com/channel/UCynIYcsBwTrwBIecconPN2Aグッズ購入はこちらから！https://tokaionair.jp/東海オンエアLINEスタンプはこちらから！https://uuum.jp/posts/614231東海オンエアLINE公式アカウント　友達登録はこちらから！https://lin.ee/c19Zdjmお仕事の依頼はこちらからhttps://www.uuum.co.jp/inquiry_promotionファンレターはこちらへ〒107-6228東京都港区赤坂9-7-1ミッドタウン・タワー 28階UUUM株式会社 東海オンエア宛【東海オンエアの個人アカウント】てつや個人チャンネル：https://www.youtube.com/channel/UC1xd0cAOryAMTTG34joEgdgX：https://twitter.com/TO_TETSUYAInstagram：https://www.instagram.com/to_tetsuya/しばゆーX：https://twitter.com/TOKAI_ONAIRInstagram：https://www.instagram.com/to___shibayu/りょう個人チャンネル：https://www.youtube.com/channel/UCigMkMDZjvLhXAQ67wKQIbAX：https://twitter.com/TO_RYOOInstagram：https://www.instagram.com/to_ryoo/としみつ個人チャンネル：https://www.youtube.com/channel/UCDFxQgB9Dc_MzxiEKjozWwgX：https://twitter.com/TO_TOSHIMITSUInstagram：https://www.instagram.com/toshimitsu_tokaionair/ゆめまる個人チャンネル：https://www.youtube.com/channel/UCevQsKO8q1XQcEA1BoBO2gAX：https://twitter.com/TO_yumemarucasInstagram：https://www.instagram.com/yumemaru_original/虫眼鏡個人チャンネル：https://www.youtube.com/channel/UCbSIiNFWbJCW8ERBbkNMfwQX：https://twitter.com/TO_ZAWAKUNInstagram：https://www.instagram.com/to_mushimegane/"
"r0S7ymJxIvA","里親になる母親と子猫たちが対面したら相性抜群で初日にまさかのこうなっちゃいました…","2024-10-14T11:01:09Z","UCplhkHsYKxXjTde1lq8F-4w","もちまる日記","Pets & Animals","24.18.10","[none]","1069791","0","0","1075","https://i.ytimg.com/vi/r0S7ymJxIvA/default.jpg","False","True","【補足】両親が、お世話に慣れるまでは茶太とおはぎとの生活に尽力したいとの意向だったため、今回はもちとはなは仲良しの友達にお留守番をお願いすることにしました。いきなり4匹が家に来たら父と母も慌ただしくなってしまうので、こうするのがベストだと思います。年末年始はもちとはなとも一緒に帰省し、また4匹揃う姿をお見せできると思います！⬇️メンバーシップへの参加はこちらhttps://www.youtube.com/@motimaru/join⬇️お問い合わせhttps://motimarunikki.com/contact⬇️公式HPhttps://motimarunikki.com/⬇️とん様https://amzn.asia/d/2ZjdpXL⬇️貢-mitsugu-プレミアムペーストhttps://mishone.jp/lp?u=mtg_pa_mochi_special⬇️オンラインストアhttps://motimaru.jp/⬇️公式LINE（限定動画配信中）https://lin.ee/BGMF0V6"
"DrPIGUu-ejs","目からうろこの雑草対策｜ドクダミをハサミで切ると凄い事が起こった","2024-10-12T09:00:12Z","UC6BciRKAq8E90HFuEQE1lQQ","庭づくり大好きおじさん","People & Blogs","24.18.10","ドクダミ駆除|ドクダミ|ドクダミ茶|雑草対策|雑草|庭づくり|庭づくり大好きおじさん|カインズ大好きおじさん|ガーデンdiy|目からうろこの雑草対策","3362632","26808","0","1163","https://i.ytimg.com/vi/DrPIGUu-ejs/default.jpg","False","False","みなさん こんにちは庭づくり大好きおじさんです。本日の動画は雑草対策です。ドクダミ駆除したい方におすすめです。またドクダミを活用する方法も紹介しています。このチャンネルはカインズや100均やその他店舗やネットなどで買った物を使ってできるだけ激安で庭diy【ガーデンdiy】した物を紹介するチャンネルです。その他、雑草対策やオープンガーデン企画や雑貨屋さん紹介もしています。よかったらチャンネル登録よろしくお願いします。コメントもお待ちしております。Hello everyoneThank you for always watchingMy video is a cheap and easy DIY channelThis is a garden DIY videoPlease subscribe to the channel if you like企業案件やお仕事の依頼は、こちらにDMください。Twitter https://twitter.com/3ilrbDoOvTiaOyB?t=miInstagramhttps://www.instagram.com/niwazukuridaisuki_ojisan/mailliubenmuz@gmail.com#雑草対策 #庭づくり #庭づくり大好きおじさん #ドクダミ駆除 #ドクダミ #ドクダミ茶#カインズ大好きおじさん"
"-upX0YfNcjA","2024年10月14日 北海道日本ハム対千葉ロッテ 試合ハイライト","2024-10-14T08:59:08Z","UC0v-pxTo1XamIDE-f__Ad0Q","(パーソル パ・リーグTV公式)PacificLeagueTV","Sports","24.18.10","パーソルパリーグTV|パリーグTV|パシフィックリーグ|Pacificleague|プロ野球","635583","8852","0","1226","https://i.ytimg.com/vi/-upX0YfNcjA/default.jpg","False","False","2024年10月14日 ファイターズ対マリーンズ(エスコンフィールド)の試合ハイライト動画。▼1分で読める試合展開https://pacificleague.com/news/67045?utm_source=youtube&utm_medium=digest■パテレグッズ好評発売中!! 各商品ご購入はこちら!!https://ptv-shop.pacificleague.com/他にもパ・リーグの注目動画がたくさん！全てを見逃さないために【チャンネル登録】を！▷https://www.youtube.com/channel/UC0v-pxTo1XamIDE-f__Ad0Q＜パ・リーグ主催全試合を生中継！パーソル パ・リーグTVはこちら！＞https://pacificleague.com/ptv✓パ・リーグ6球団公式情報をお届け：https://pacificleague.com/news✓パ・リーグの過去映像を見るなら：https://www.youtube.com/channel/UCrjlKkKTAyNn6gekRM3p0Aw/SNSも毎日更新中！▶X：https://twitter.com/PacificleagueTV▶Instagram：https://www.instagram.com/pacificleaguetv/▶Facebook：https://www.facebook.com/pacificleaguetv▶LINE：https://lin.ee/2hB4obT#北海道日本ハムファイターズ #千葉ロッテマリーンズ #NipponhamFighters #北海道日本火腿 #LotteMarines #千葉羅德 #パーソルパリーグTV #パシフィックリーグ"
"PCxUROCKw0E","【①2024ドラ１は誰だ】今年も仮想ドラフト会議にレジェンド5人が集結！果たして注目の逸材はどの球団に！？「プロ野球ドラフトちゃんねる」スカイA公式","2024-10-14T09:00:31Z","UCSzd2tlFW_DvVPp44JmaUrg","プロ野球 ドラフトちゃんねる","People & Blogs","24.18.10","[none]","208856","1133","0","103","https://i.ytimg.com/vi/PCxUROCKw0E/default.jpg","False","False","スカイA「第5回プロ野球仮想ドラフト会議」プロ野球ドラフト会議の直前に、プロ野球レジェンドOBたちが各球団のドラフト戦略、注目選手を徹底解剖！今年のドラフト１位は誰だ！【レジェンド OB】古田敦也、谷繁元信、赤星憲広、福留孝介、松田宣浩【ドラフトハンター】西尾典文(スポーツライター)【MC】寺田健人【アシスタント】福戸あや (ABC テレビアナウンサー)放送予定2024/10/12(土) 20:00～22:002024/10/15(火) 12:00～14:00 2024/10/16(水) 25:00～27:00 2024/10/17(木) 23:00～25:00 2024/10/22(火) 20:00～22:00#2024ドラフト　#ドラフト　#運命の日"
"oXc3pmhf90A","【直近情報】2024年10月ドラフト注目選手＜大学生編＞今年は大豊作！レジェンドも唸る逸材一挙紹介！「プロ野球ドラフトちゃんねる」スカイA公式","2024-10-14T03:00:40Z","UCSzd2tlFW_DvVPp44JmaUrg","プロ野球 ドラフトちゃんねる","People & Blogs","24.18.10","[none]","204001","1159","0","248","https://i.ytimg.com/vi/oXc3pmhf90A/default.jpg","False","False","【直近情報】2024年10月ドラフト注目選手＜社会人編＞レジェンド5人も絶賛の逸材たち！https://youtu.be/Ypl5iv6dXkk【2024ドラ１は誰だ】今年も仮想ドラフト会議にレジェンド5人が集結！果たして注目の逸材はどの球団に！？https://youtu.be/PCxUROCKw0EスカイA「第5回プロ野球仮想ドラフト会議」プロ野球ドラフト会議の直前に、プロ野球レジェンドOBたちが各球団のドラフト戦略、注目選手を徹底解剖！今年のドラフト１位は誰だ！【レジェンド OB】古田敦也、谷繁元信、赤星憲広、福留孝介、松田宣浩【ドラフトハンター】西尾典文(スポーツライター)【MC】寺田健人【アシスタント】福戸あや (ABC テレビアナウンサー)放送予定2024/10/12(土) 20:00～22:002024/10/15(火) 12:00～14:00 2024/10/16(水) 25:00～27:00 2024/10/17(木) 23:00～25:00 2024/10/22(火) 20:00～22:00#2024ドラフト　#即戦力　#大学生"
"5F1kjNmeOOM","【朝倉未来】結婚式にサプライズ登場して歌ってきた","2024-10-12T10:00:10Z","UC7MvTslTWkE1HKNYkXiGv1Q","優里ちゃんねる【公式】","People & Blogs","24.18.10","[none]","1239358","25657","0","1170","https://i.ytimg.com/vi/5F1kjNmeOOM/default.jpg","False","False","未来くん側での動画はこちら！https://youtu.be/27mTxk1MDqg?si=anM-77BJXdKjoViR朝倉未来くんYouTube：@mikuruasakura1 Instagram：https://www.instagram.com/mikuruasakura/TikTok：https://www.tiktok.com/@mikuruasakura鍵盤弾きの優里くんX：https://twitter.com/yuri_moriyaInstagram：https://www.instagram.com/yu_rimoriya/https://youtu.be/aJlNS-JvO9E?si=Ez5v6ehgQHpeIsD2https://youtu.be/w0aMENa7niY?si=gz0IhZTHwBYAcz9yhttps://youtu.be/QCODJoehaHk?si=wGuGRkyoBr-gCHtfhttps://youtu.be/DglkI_7M-Sw?si=6CrAKnGB8fDOE53X優里の曲はこちら:https://lnk.to/PO4pBF優⾥ちゃんねる200万⼈達成するぞ TOUR 2024NEWグッズ販売開始！Tシャツ、キーホルダー、ハンドストラップ、クリアバッグ、ランダムくじをNEWラインナップ。会場での販売は、7月15日（祝月） 群馬・高崎芸術劇場公演からの販売となります。https://official-goods-store.jp/yuuri/優里オフィシャルメンバーズルームゆーりんちがついに発足！優里自身が更新する「BLOG」、YouTubeでは見ることのできないゆーりんち限定の「MOVIE」やどこよりも早くエントリー可能な最速チケット先行受付、ライブ・レコーディング風景やオフショットなど優里をより身近に感じることができる「GALLERY」など、盛り沢山な内容となっております！▼オフィシャルメンバーズルーム「ゆーりんち」入会はこちら▼https://yuurinchi.com/・優里 SNSX：https://twitter.com/yuuri_officialinstagram：https://www.instagram.com/yuuri__music__official/TikTok：https://www.tiktok.com/@yuuri_music_official・JUN MIYASAKA SNSX：https://twitter.com/Jun_Yuuri_CHinstagram：https://www.instagram.com/__juntleman__/TikTok：https://www.tiktok.com/@_juntleman_・げんた SNSX：https://twitter.com/Genta_Yuuri_CHinstagram：https://www.instagram.com/g_zooo1/・NARI SNSX：https://twitter.com/nari_9973instagram：https://www.instagram.com/oolong_nari_tea/TikTok：https://www.tiktok.com/@_nari_official・リョータ(優里ちゃんねる編集スタッフ) SNSX：https://twitter.com/Hensyu_Yuuri_CHInstagram：https://www.instagram.com/uta_agtvo/TikTok：https://www.tiktok.com/@u__t__a__#優里#サプライズ#結婚式#朝倉未来▶︎案件、コラボ、お仕事のご依頼はこちらyuuri.oshigoto@gmail.com〜優里ちゃんねるより切り抜き動画についてのお知らせ〜優里ちゃんねるではより多くの方に当チャンネルや優里のことを知ってもらえるように、いつもご覧頂いている皆さまで自由に切り抜き動画を作って頂きたいと考えております！全ての動画からご使用頂いて構いませんので、面白いと思った部分や名場面シーンをぜひ切り抜き動画で公開してもらえると嬉しいです。その際は #優里ちゃんねる をお忘れなく！"
"tW1GAkusjF4","【公式】キングオブコント2024 オープニング楽曲","2024-10-12T13:01:07Z","UCvHjqot4S5xj5J8RlQE-MYw","キングオブコント","Entertainment","24.18.10","[none]","580441","13650","0","1007","https://i.ytimg.com/vi/tW1GAkusjF4/default.jpg","False","False","梅田サイファーとのスペシャルコラボ#カーネクスト presents#キングオブコント 2024熱き戦いを繰り広げたコント師10組を今年も華麗に紹介したオープニングスぺシャルコラボ楽曲をぜひ！ーーーーーーーーーーーーーーーーーーーー■公式HPhttps://king-of-conte.com/ ■公式X(旧Twitter)https://x.com/koc_staff 👑冠スポンサー カーネクスト■公式X(旧Twitter)https://mobile.x.com/CARNEXT_JP/highlights"
"_VKrAB6XS20","【産後入院生活】初めて語る 妊娠中の障壁と活動休止の理由。","2024-10-12T11:01:36Z","UCwGNwOsWOX4v-3k2JO088SQ","フミカナ","Entertainment","24.18.10","[none]","1065061","14137","0","753","https://i.ytimg.com/vi/_VKrAB6XS20/default.jpg","False","False","_撮影協力：代官山バースクリニック https://db-clinic.jp/※代官山バースクリニックより、本投稿に関する全ての承諾を得ております。_【メンバーシップ参加はこちらから】今後、hannaとの生活をUPしていきます♡https://www.youtube.com/channel/UCwGNwOsWOX4v-3k2JO088SQ/join_広告・イベント等の各種お仕事ご依頼は下記公式窓口からお問い合わせください。https://form.run/@fumikana1020_インスタグラムでは最新の発信をしています🩶👶🏼HANNAアカウントhttps://www.instagram.com/hanna_l.m?igsh=MW40dWNsZnFiZWRpdw==👩🏽KANAMIアカウントhttps://www.instagram.com/kanami_0530🧔🏽FUMIYAアカウントhttps://instagram.com/fumiya_1105_?igshid=YmMyMTA2M2Y=_ _"
