video_id,title,publishedAt,channelId,channelTitle,category,trending_date,tags,view_count,likes,dislikes,comment_count,thumbnail_link,comments_disabled,ratings_disabled,description
"dL4dkuS96MQ","【イライラ20 #2】福留光帆が四千頭身 都築を20回イラつかせる！…はずがラッシュが止まらず都築ノックアウト！","2024-10-09T10:00:40Z","UCaPJaMy0_OZlNjq7BVyTnkA","佐久間宣行のNOBROCK TV","Entertainment","24.18.10","NOBROCKTV|佐久間宣行|お笑い|バラエティ|100ボケ100ツッコミチャレンジ|口喧嘩最強女子オーディション|みりちゃむ罵倒シリーズ|ドーピングドッキリ|みりちゃむ|風吹ケイ|二瓶有加|福留光帆|森脇梨々夏","2174081","46010","0","6423","https://i.ytimg.com/vi/dL4dkuS96MQ/default.jpg","False","False","福留光帆が偽番組で共演する芸人を20回イラつかせるまでのタイムを競う「イライラ20チャレンジ」第二弾！今回のターゲットは、四千頭身 都築！福留の鋭利すぎるワードセンスが火を吹き、都築は早々にお手上げ状態に！目がバキバキにキマりフルスロットルな福留と、完膚なきまでにやられる都築をご堪能ください！ゲスト福留光帆｜https://x.com/FukutomeMitsuho都築拓紀（四千頭身）｜https://x.com/tzk0320「第1回イライラ20 vs ラランドニシダ」はこちら▼【新企画イライラ20】福留光帆は何も知らないラランドニシダを、20回イライラさせられるのか？https://youtu.be/0FKe0Pj8tAA▼▼▼再生リストはこちら▼▼▼＜罵倒村｜The abuse village＞https://youtube.com/playlist?list=PLGzqNw3ks0N-Q9t42KDoomUtEgUkwo5Ub＜100ボケ100ツッコミチャレンジ＞https://youtube.com/playlist?list=PLGzqNw3ks0N86HQQ___5zt5EK_TDVvGMX＜みりちゃむ罵倒シリーズ＞https://youtube.com/playlist?list=PLGzqNw3ks0N9zQHU8uIQHUKf2sbHNGJ3S＜逸材 福留光帆シリーズ＞https://youtube.com/playlist?list=PLGzqNw3ks0N-wqRr8Lg6G-buIZ7as8fSX＜ピュアすぎる森脇梨々夏シリーズ＞https://youtube.com/playlist?list=PLGzqNw3ks0N8TioialXvU6FE0l7D-sefc＜風吹ケイセクシーシリーズ＞https://youtube.com/playlist?list=PLGzqNw3ks0N_7Ft_C9-k29q7DVTtb2XyR＜下ネタで笑いたくない女優・二瓶有加シリーズ＞https://youtube.com/playlist?list=PLGzqNw3ks0N9mQwTVp8sBeuuNi9qtScfr＜裏では〇〇ドッキリ＞https://youtube.com/playlist?list=PLGzqNw3ks0N8HHV8xtR4W58Itp8mQWYUZ＜操り師インパルス板倉先生操りドッキリ＞https://youtube.com/playlist?list=PLGzqNw3ks0N8OS30z7jh1HZtSRcoxBUKF＜ウエストランドM-1優勝記念！出演動画再生リスト＞https://youtube.com/playlist?list=PLGzqNw3ks0N9V9v853T_jgD69001xAu_u＜ぶっこみアイドル越え選手権＞https://youtube.com/playlist?list=PLGzqNw3ks0N9d81MOrX7oJxSbChUxGgSf＜エステしないエステティシャン選手権＞https://youtube.com/playlist?list=PLGzqNw3ks0N8bFiLbJc46j_3nNxK-kzTq＜マジトーク＞https://youtube.com/playlist?list=PLGzqNw3ks0N9fU2dRGcbtCfbthPw2_eAx＜架空請求業者撃退番組かと思いきや全部コントでしたドッキリ＞https://youtube.com/playlist?list=PLGzqNw3ks0N91ttVSIfmqeoSss1Qy6z5z＜口喧嘩最強女子シリーズ＞https://youtube.com/playlist?list=PLGzqNw3ks0N_w2rqbsBJM4ypuqDrOmGUU＜芸能界天下取り将棋＞https://youtube.com/playlist?list=PLGzqNw3ks0N-iRoRWCZZYnnsiEHLBO0Hk＜ムカつく面接キャラ選手権＞https://youtube.com/playlist?list=PLGzqNw3ks0N-bh8-wT99HTFnXdaoUZa2H＜ティモンディ高岸に励まされたら誰でも元気になれるのか選手権＞https://youtube.com/playlist?list=PLGzqNw3ks0N8q7nxJRjvwdfffSNGRbg6C＜妄想トーク集＞https://youtube.com/playlist?list=PLGzqNw3ks0N9iQH-Tl5cDnktAEOC2Ybra＜操りドッキリ系＞https://youtube.com/playlist?list=PLGzqNw3ks0N_qHlKDE8Rlj17KeaAImHNK＜俺の悪いところ言ってくれ選手権＞https://youtube.com/playlist?list=PLGzqNw3ks0N-Kz-h7seVxDmlGmNIMXihX＜裏方記憶飛ばしグルメ＞https://youtube.com/playlist?list=PLGzqNw3ks0N8OhF-ShOZCQmZC-Eu_e1sM＜お笑い知識ゼロのスポンサーに笑いを説明できるのか？＞https://youtube.com/playlist?list=PLGzqNw3ks0N9Mg1ADkSnpFiw_847tUunk＜バンドの曲紹介みたいにネタする−１GP＞https://youtube.com/playlist?list=PLGzqNw3ks0N_VQh1XulToeSDn3CxEMK-g＜その他＞https://youtube.com/playlist?list=PLGzqNw3ks0N_me6W08U5nzBjAn9R__7-Z＜18禁＞https://youtube.com/playlist?list=PLGzqNw3ks0N_R-RMsmVUdCDymgr0Yg4Ox「佐久間宣行のNOBROCK TV」Twitterアカウントhttps://twitter.com/nobrockTV_info「佐久間宣行のNOBROCK TV」TikTokアカウントhttps://www.tiktok.com/@nobrocktv_info「佐久間宣行のNOBROCK TV」Instagramアカウントhttps://www.instagram.com/nobrocktv_info/サブチャンネル『BSノブロック〜新橋ヘロヘロ団〜』YouTubeアカウントhttps://www.youtube.com/@BS_NOBROCKサブチャンネル『BSノブロック〜新橋ヘロヘロ団〜』Xアカウントhttps://x.com/BS_NOBROCK罵倒Vtuber『五百鬼ノノシル』YouTubeアカウントhttps://www.youtube.com/@nonoshiru_ioki罵倒Vtuber『五百鬼ノノシル』Xアカウントhttps://x.com/nonoshiru_ioki佐久間Pプロデュースアイドルグループ『ラフ×ラフ』公式YouTubeチャンネルhttps://www.youtube.com/channel/UCETGW_rKwrERFi2ivU8GJgg#NOBROCKTV#福留光帆#四千頭身都築#佐久間宣行【企業案件について】企業案件に関するお問い合わせは、info@nobrocktv.jp までご連絡のほど、よろしくお願いいたします。"
"UcXJmi-AzZs","King & Prince 「POPSTAR in the KINGDOM」 Behind the scenes Teaser","2024-10-10T11:00:35Z","UCSxwcQnzA5K6DvofvBn6ATA","King & Prince","Music","24.18.10","King & Prince|永瀬廉|Nagase Ren|髙橋海人|Takahashi Kaito|キンプリ|きんぷり|KP|King|Prince|キングアンドプリンス|きんぐあんどぷりんす|Dance|ダンス|MV|Music Video|ReERA|リエラ|Re:ERA|WOW|POPSTAR in the KINGDOM|SKY-HI","345726","23115","0","2224","https://i.ytimg.com/vi/UcXJmi-AzZs/default.jpg","False","False","オフィシャルHP：https://kingandprince6th.jp/CD予約はこちら：http://lnk.to/6thAL6th Album『Re:ERA』★2024.9.30(mon) 「WOW」 Digital Releasehttps://lnk.to/6th0930★2024.10.14(mon) 『Re:ERA』Digital Release★2024.12.11(wed) 『Re:ERA』CD Release6枚目となるオリジナルアルバム『Re:ERA』が12月11日に発売。サブスクやダウンロードサービスは10月14日より配信。(アルバム表題曲「WOW」は09月30日より先行配信。) 新曲「WOW」は、アーティスト三浦大知氏と音楽プロデューサーUTA氏とメンバー髙橋海人とのコラボ制作。振り付けは三浦大知氏が手掛けている。新たなる挑戦が最新アルバム『Re:ERA』は、King & Princeとしての新境地を開く初めてのコンセプトアルバム。今作は全曲を通じて一つの物語が描かれており、収録曲数分の全16体のキャラクターなどをメンバー髙橋が描き下ろし、楽曲からインスパイアされたキャラクターや壮大なストーリーまで創り上げた。収録楽曲は、新曲「WOW」や「halfmoon」「moooove!!」「愛し生きること」「MAGIC WORD」や新曲含めて16曲が収録。初回限定盤Aの特典映像には、「WOW」 Music Videoや「WOW」 Music Video Behind the scenesと「6歳は誰だ！？ 同期当てクイズ」を収録、初回限定盤Bの特典映像には、『Re:ERA』Behind the scenesや「POPSTAR in the KINGDOM」 Behind the scenesと「染み」 Behind the scenesが収録。■初回限定盤A 【CD＋DVD】￥4,290(税込) / UPCJ-9055【CD収録内容】全15曲収録　※全形態共通【DVD収録内容】　・「WOW」 Music Video　・「WOW」 Music Video Behind the scenes　・6歳は誰だ！？ 同期当てクイズ仕様：三方背ケース付2Dケース、フォトブックレット24P、歌詞ブックレット20P ■初回限定盤B 【CD＋DVD】￥4,290(税込) / UPCJ-9056【CD収録内容】全15曲収録　※全形態共通【DVD収録内容】　・『Re:ERA』Behind the scenes　・「POPSTAR in the KINGDOM」 Behind the scenes　・「染み」 Behind the scenes　仕様：三方背ケース付2Dケース、フォトブックレット24P、歌詞ブックレット20P ■通常盤（初回プレス）【CD】￥3,520(税込) / UPCJ-9057【CD収録内容】全16曲収録　※全形態共通、通常盤のみ１曲追加　仕様：三方背ケース付3Pワイドケース、歌詞ブックレット20P ※通常盤(初回プレス)／UPCJ-9057終了後、通常盤／UPCJ-1008に切り替わります。 ■Dear Tiara盤（ファンクラブ限定盤）【CD】￥4,290(税込) / PROJ-1926【CD収録内容】「WOW」「愛し生きること」「MAGIC WORD」「halfmoon」「moooove!!」　含む全15曲収録 　仕様：104Pノート型ジャケット(A4サイズ)【CD収録内容】1.Odyssey　　2.WOW3.HOTTER & HOTTER　　4.Don't Grow Up5.COLORS　　6.LOVE HACKER　　7.moooove!!　　8.POPSTAR in the KINGDOM (髙橋海人)9.ボーイミーツガール　　10.愛し生きること　　11.染み (永瀬廉)　　12.ROLLER COASTER13.MAGIC WORD　　14.halfmoon　　15.I Will...　　16.Harajuku（通常盤のみ収録）■封入特典・初回限定盤A/特典：トレーディングカードAタイプ 1種・初回限定盤B/特典：トレーディングカードBタイプ 1種・通常盤(初回プレス)/特典：トレーディングカードCタイプ 1種　※各特典ごとに写真は異なります。■初回封入特典・初回限定盤Ａ／期間限定動画Ａ視聴シリアルナンバー・初回限定盤B／期間限定動画B視聴シリアルナンバー・通常盤（初回プレス）／期間限定動画C視聴シリアルナンバー視聴期間：2024年12月10日(火) 昼12:00～2025年1月10日（金）18:00まで■先着外付け特典・初回限定盤A／特典：フォトカード（A6）・初回限定盤B／特典：クリアポスター（A4）・通常盤(初回プレス)／特典：トレカ3種セット※3形態同時購入特典：オリジナルトレカケース・Dear Tiara盤／特典：ステッカーシート（A6）#KingandPrince #ReERA #POPSTARintheKINGDOM #WOW"
"i9z4sgHTZqA","【270万円】海外で特注した全てが異常過ぎるテントを買って作ってみた。","2024-10-11T08:26:13Z","UCgMPP6RRjktV7krOfyUewqw","はじめしゃちょー（hajime）","Entertainment","24.18.10","hajime|はじめしゃちょー|funny|crazy|japanese|はじめ","1666877","21983","0","1668","https://i.ytimg.com/vi/i9z4sgHTZqA/default.jpg","False","False","チャンネル登録よろしくおねがいします !My name is Hajime! 特別な許可を得て撮影しております。ファンサイトはこちら。▽「はじメーノ」：https://fanicon.net/fancommunities/4246はじめしゃちょーの畑：https://www.youtube.com/channel/UClKeJXipXwX7_ZGxOBnMQywはじめしゃちょー2（ゲーム実況など）：https://www.youtube.com/user/hajimexgameX(Twitter): https://twitter.com/hajimesyachoInstagram: https://instagram.com/hajimesyachodesu?r=nametagTikTok: https://vt.tiktok.com/ZSJ18mmm5/Clubhouse:@hajimen裏垢:https://twitter.com/duelhajimeLINEスタンプはこちら！はじめしゃちょーhttps://store.line.me/stickershop/product/1072663/jaはじめしゃちょー2https://store.line.me/stickershop/product/1169745/ja・動画内における素材提供 ＿人人人人＿＞　PIXTA　＜￣Y^Y^Y￣------------------------------------------------------------------------------ 楽曲提供：Production Music by http://www.epidemicsound.com                     フリーBGM DOVA-SYNDROME by http://dova-s.jp/　　　　　BGMer:https://bgmer.net/------------------------------------------------------------------------------"
"FJWLj1-kGC0","MISAMO「NEW LOOK」Music Video","2024-10-08T15:00:16Z","UCCRb6nYKaT8tzLA8CwDdUtw","TWICE JAPAN OFFICIAL YouTube Channel","Music","24.18.10","MISAMO|ミサモ|NEW LOOK|ニュールック|安室奈美恵|TWICE|トワイス|トゥワイス|ナヨン|ジョンヨン|モモ|サナ|ジヒョ|ミナ|ダヒョン|チェヨン|ツウィ|K-POP|TT|ONCE|트와이스|ダンス","5884469","332499","0","14135","https://i.ytimg.com/vi/FJWLj1-kGC0/default.jpg","False","False","2024.11.6 Release MISAMO JAPAN 2nd MINI ALBUM『HAUTE COUTURE』MISAMO「NEW LOOK」Music Video【いい音楽で一度、素晴らしいパフォーマンスで二度魅了させる】と言う意味を持つ、Asia No.1最強ガールズグループTWICEの日本人メンバーMINA、SANA、MOMOの3名からなるユニットMISAMO。アルバムに収録されるサブリード曲「NEW LOOK」のMusic Videoが公開！「NEW LOOK」は安室奈美恵氏が2008年にリリースした楽曲。今回MISAMOが、カバーという形で再現。公開されたMVは、「過去の憧れにインスパイアされた現在のMISAMOが、憧れの舞台を再解釈して披露する」といった内容。 MISAMOが「NEW LOOK」をカバーするに至った過程と、安室奈美恵氏へのリスペクトを表現した内容でもある。時代や背景は違えど誰かに憧れをもって努力する、といったストーリーが、同じ経験を持つ多くの人に向けたエールになることを願う！#MISAMO_NEWLOOK #MISAMO #NEWLOOK---------------------------------「NEW LOOK」HOLLAND EDDIE / HOLLAND BRIAN / DOZIER LAMONT HERBERT / T.KURA / MICHICO©STONE AGATE MUSIC Permission granted by SONY MUSIC PUBLISHING (JAPAN) INC.©️2008 avex music publishing Inc. & Rising Publishers Co., Ltd & Sony Music Publishing (Japan) Inc.---------------------------------MISAMO JAPAN 2nd MINI ALBUM『HAUTE COUTURE』特設サイト：https://www.twicejapan.com/feature/HAUTECOUTURE「NEW LOOK」配信中：https://MISAMO.lnk.to/NewLook---------------------------------TWICE OFFICIAL FANCLUB ONCE JAPANhttp://oncejapan.comTWICE JAPAN OFFICIAL SITEhttp://www.twicejapan.comTWICE JAPAN OFFICIAL TWITTERhttps://twitter.com/jypetwice_japanTWICE JAPAN OFFICIAL INSTAGRAMhttps://www.instagram.com/jypetwice_japan/TWICE JAPAN OFFICIAL YouTube Channelhttps://www.youtube.com/c/twicejapanofficialTWICE JAPAN OFFICIAL TikTokhttps://www.tiktok.com/@twice_tiktok_officialjp---------------------------------"
"2JPLqGnM9IA","『3年Z組銀八先生』スーパーティザーPV","2024-10-10T13:10:00Z","UCFyBWO9SUQfKpuV7uF8Rh5A","銀魂チャンネル【公式】","Entertainment","24.18.10","銀魂|gintama|銀魂 THE FINAL|THE FINAL|空知英秋|空知|ゴリラ|ジャンプ|眼鏡|メガネ|万事屋|坂田銀時|志村新八|神楽|定春|エリザベス|真選組|新選組|高杉|万屋|土方|近藤|沖田|松陽|杉田智和|釘宮理恵|阪口大助|中井和哉|千葉進歩|鈴村健一|石田彰|子安武人|山寺宏一|紅桜|アニメ|漫画|完結篇|終わる終わる詐欺|宮脇千鶴|藤田陽一|高松信司|SPYAIR|DOES|前川貴史|樋口弘光|大西恒平","668729","31882","0","1023","https://i.ytimg.com/vi/2JPLqGnM9IA/default.jpg","False","False","2025年10月テレ東系列にて放送決定！本当のPVはジャンプフェスタ202512月21日(土)15：40～BLUEステージにて公開！！お楽しみに！！『3年Z組銀八先生』のティザーサイトもオープンしました！　https://anime-gintama.com/ginpachi/■「銀魂」20周年記念サイト　 https://anime-gintama.com■「生誕20周年記念　銀魂展　～はたちのつどい～」公式サイト　 https://gintama20th-ten.com/■「銀魂オンシアター」ポータルサイト 　https://anime-gintama.com/on_theater_2d/■「銀魂」アニメ公式X（旧Twitter）　https://x.com/gintamamovie ■『銀魂』は下記配信サービスで配信中！　バンダイチャンネル  https://www.b-ch.com/titles/2611/　Hulu https://www.hulu.jp/gintama　ふらっと動画 https://douga.flat-flat.jp/　TELASA https://www.telasa.jp/unlimited　J:COM STREAM https://linkvod.myjcom.jp/　dアニメストア https://animestore.docomo.ne.jp/animestore/tp_pc　U-NEXT https://video.unext.jp/　アニメ放題https://www.animehodai.jp/　NETFLIX https://www.netflix.com/jp/　ABEMA https://abema.tv/video/title/13-47　Prime Video https://www.amazon.co.jp/gp/video/storefront　Lemino　 https://lemino.docomo.ne.jp/　Google play  http://play.google.com/store/movies　HAPPY!動画 https://a.happydouga.jp/　Rakuten TV https://tv.rakuten.co.jp/content/33589/　ムービーフルplus  http://mfplus.jp/　ビデオマーケットhttps://www.videomarket.jp/　ニコニコチャンネルhttps://ch.nicovideo.jp/ Ⓒ空知英秋･大崎知仁／集英社･「3年Z組銀八先生」製作委員会#銀八先生 #GinpachiSensei#銀魂 #gintama"
"eRouzwlpVto","1年休止してました【フォートナイト/Fortnite】","2024-10-10T07:00:32Z","UCLFiFaxDZc3FmdU8fAJNKYw","ねこくん","Gaming","24.18.10","フォートナイト|Fortnite|ねこくん|新武器|アジア1位|プロゲーマー","599887","21086","0","3806","https://i.ytimg.com/vi/eRouzwlpVto/default.jpg","False","False","「投稿頻度は徐々に上げていきます(週2-3上げたいです)」X : https://x.com/__Necko【使用している音楽等】NCS: https://www.youtube.com/user/NoCopyrightSoundsDOVA-SYNDROME:https://dova-s.jp/#ねこくん"
"xF1TeStXoxM","名捕手たちがブチ切れ！衝撃の大乱闘事件 ＆ 本当にあった『死球のサイン』のウラ側【キャッチャーサミット】","2024-10-11T12:01:16Z","UCbf6IAYfPy8CwHVgcHbxmNw","フルタの方程式【古田敦也 公式チャンネル】","Sports","24.18.10","[none]","454456","5216","0","256","https://i.ytimg.com/vi/xF1TeStXoxM/default.jpg","False","False","最近は見ることも少なくなった試合中の大乱闘。痛みや恐怖と戦った5人が、当時を振り返ります。さらに、かつて球界に存在した禁断の『死球のサイン』のお話も。▼その他のキャッチャーズバイブルはこちら▼https://youtube.com/playlist?list=PLv_EcNe47s5m8PxnHE26O2JcvVLFWceOM00:00 中尾＆古田には出ていた！ 広島に存在した『死球のサイン』01:13 事件簿① 達川vs中尾 クロスプレーで顔面殴打事件04:21 事件簿② 西山vs池山 伏線があった右ストレート事件06:17 体格によっても変わる 捕手ごとのタックル対策07:50 達川光男が恐れるほどうまかった 捕手・中尾孝義の技術10:43 中尾孝義が初めて捕手用ヘルメットを着用した理由11:44 事件簿③ 袴田vsブライアント 恐怖を覚える強烈タックル15:01 ブライアント・スミス 印象的だった強力助っ人16:40 実はここまで全てオープニングトークでした#プロ野球 #乱闘 #昭和●X(旧Twitter)https://twitter.com/furuta_atsuya27●Instagramhttps://instagram.com/atsuyafuruta?igshid=1qp70xr01hq90●書籍の案内[フルタの方程式(DVD付)] https://amzn.to/2PUFepF[フルタの方程式　バッターズ・バイブル]https://amzn.to/3ek6HKK"
"p-T9QNnC6k8","BreakingDown14オーディションに芸能界の大物が応募してきた⁉【前編】","2024-10-10T11:01:10Z","UCbqtn4vldMg5HjKims7MWfw","KAI Channel / 朝倉海","Entertainment","24.18.10","朝倉海|KAIChannel|かいちゃんねる","495262","3907","0","380","https://i.ytimg.com/vi/p-T9QNnC6k8/default.jpg","False","False","▼BreakingDown14 メインスポンサー SILK THE RICH様https://silktherich.com/lp?u=breakingdown13▼BreakingDownを題材にした映画「BLUE FIGHT」PPV前売り券購入はこちらからhttps://yoake-f.jp/bluefight▼スポンサー応募・詳細はこちらからhttps://backstage.inc/breakingdown/sp▼BreakingDown公式アプリ衝撃のオーディション未公開映像配信！https://breakingdownlive.page.link/dl3▼BreakingDown専属レフェリーの応募はこちらからhttps://forms.gle/SPNkMWpgvqGJfnMA9▼BreakingDown公認切り抜きの応募はこちらからhttps://docs.google.com/forms/d/e/1FAIpQLSelJMphLDhHZ8-_HUKnbhBjYOUm_WHVgcKBUAcNMXAqIRqdyA/viewform▼BreakingDown14 ゴールドスポンサー 拳極様https://c-hance.co.jp/LP/DL/download_SP_youtube.php▼BreakingDown14 ゴールドスポンサー RBL様https://roland-bl.jp▼BreakingDown14 ゴールドスポンサー 業餃業様https://gyogyogyo.store/▼BreakingDown14 ゴールドスポンサー ポスティングホールディングス様https://postech.co.jp/▼BreakingDown14 シルバースポンサー INSTEP様https://instep.chat/▼BreakingDown14 シルバースポンサー HTF様https://h-t-f.shop/▼BreakingDown14 シルバースポンサー 未来の育毛剤VO-VO-様https://vovo-official.jp/▼BreakingDown14 シルバースポンサー H.L.B様https://hlb.ink/▼BreakingDown14 シルバースポンサー PREWAN様https://prewan.co.jp/▼BreakingDown14 シルバースポンサー mr. stick様https://mrstick.jp/▼BreakingDown14 シルバースポンサー エメルテクリニック様https://aimerte-clinic.com/aimerte/lp-f6ifmty-12.html▼BreakingDown14 シルバースポンサー t-clinic様https://tclinic-official.com/▼BreakingDown14 シルバースポンサー ザ・スカルプ様https://tclinic-official.com/lp_scalpairmedical_01/▼日本こども支援協会https://npojcsa.com/▼違法動画報告専用フォームhttps://forms.gle/wcw2GVADf9GLcqxc7※Breaking Downでは各プラットフォームと連携して違法動画の対策と撲滅をしていきます。悪質な違法アップロードに関しては法的措置も行います。◆WAVERS〜革命の海〜 (オンラインコミュニティ)　https://waversrev.page.link/app?externalBrowser=1◆『EN MER』朝倉海の手がけるアパレル/スポーツウェアブランド　https://enmer.net/◆公式　LINE友達追加：https://lin.ee/1TjhDnN　グッズ：https://shop.kai-asakura.com/◆SNS　朝倉海　ーinstagram：https://instagram.com/kai_asakura_/　ーtwitter：https://twitter.com/kai_1031_　ーTikTok：https://www.tiktok.com/@kaiasakura_　サイトウ　ーinstagram：https://www.instagram.com/saito_0327_/　ーtwitter：https://twitter.com/Saito_0327_　ーTikTok：https://www.tiktok.com/@saito_0327　オオモリ　ーinstagram：https://www.instagram.com/e_c_omori/　ーtwitter：https://twitter.com/e_c_omori　ーTikTok：https://www.tiktok.com/@e_c_omori◆YouTube　サブチャンネル：https://www.youtube.com/channel/UCEReo3ko80VlilHyIM-Lm9Q?sub_confirmation=1　instagram：https://instagram.com/kai_ch_youtube　twitter：https://twitter.com/kai_ch_youtube◆お仕事の相談・お問い合わせはこちらまで　E-Mail：kai.toiawase@gmail.com◆音源は以下のサービスを利用しています。　H/MIX Gallery：http://www.hmix.net/　Music is VFR：http://musicisvfr.com/free/license.html　MusMus：http://musmus.main.jp/　効果音ラボ：https://soundeffect-lab.info 　DOVA-SYNDROME：https://dova-s.jp　音楽の卵：http://ontama-m.com　ニコニ・コモンズ：https://commons.nicovideo.jp/materials/　ED協力：KICS(https://www.youtube.com/channel/UCxE78QWWRGsgV4v-vZHErog?sub_confirmation=1)#朝倉海#KAIChannel#かいちゃんねる#asakurakai"
"fCVAd8lshNo","ヴァンダルの名誉の為に生徒を矯正するLaz【にじEXヴァロ】","2024-10-10T08:00:28Z","UCqf8Mlsu9tsWigALK2gT-1g","Lazvell","Gaming","24.18.10","Valorant|Laz|Absolute|JUPITER|解説|ヴァロラント|最強|日本一|プロ|スキル|初心者|レディアント|Radiant|大会|ZETA DIVISION","249054","5183","0","99","https://i.ytimg.com/vi/fCVAd8lshNo/default.jpg","False","False","X: https://twitter.com/lazvellTwitch: https://www.twitch.tv/lazvellblog(設定とか): https://lazvell.com/🖥使用コラボPCAMD Ryzen 9とGeForce RTX 3090搭載ミドルタワーゲーミングPC [SSD搭載]https://zetadi.vision/LEVEL_YTクリエイターコード：ZETALAZクリエイターコード使用方法：https://zetadi.vision/creatorcode_YT・使用BGMOP : By My Side by K SolisED : Masked Heroes by Vexento--Related Videos--にじさんじの無限民と顔合わせをするLaz【VALORANT】https://youtu.be/q0hQKbBVvGgBEST of ZETA Laz - HIGHLIGHT vol.6【VALORANT】https://youtu.be/qhzQxvCQPfY⚡ZETA DIVISIONX - https://twitter.com/zetadivisionInstagram - https://www.instagram.com/zetadivision/Web - https://zetadivision.com/STORE - https://store.zetadivision.com/🤝Partners日清食品 - https://www.nissin.com/jp/JCB - https://www.jcb.jp/LEVEL∞ - https://www.pc-koubou.jp/pc/game.phpZENAIM - https://zenaim.com/INZONE - https://www.sony.jp/inzone/Red Bull - https://www.redbull.com/jp-ja/energydrinkHerman Miller - https://www.hermanmiller.com/ja_jp/#Laz #VALORANT #ZETADIVISION"
